{
  "schema_version": "1.0.0",
  "contract_ref": "contract.json",
  "revision": 4,
  "coordinate_frame": "threejs_meters_yup",
  "selected_visual_direction": {
    "id": "dir_01_1974_walnut_anodised_studio",
    "name": "1974 American Black Walnut & Charcoal Anodised Laboratory Console (Dark-Room PS5 Pro PBR Revision 4)",
    "rationale": "Combines luthier-oriented oiled American walnut cabinetry with clearcoat and wood-pore normal/roughness maps, deep charcoal-black brushed anodised aluminium panels (#101215) with engraved module bay seams, corner screws, and potentiometer shaft bushings, high-contrast warm cream silk-screened scales (#faf2e0), 56-segment bevelled fluted black bakelite knobs, woven braided 3D patch cables routed cleanly through the inter-row corridor, and a dark gunmetal direct-drive turntable deck with a 240-segment 2-track strobe platter and sculpted strobe prism under a custom 1974 dark-room studio softbox HDRI.",
    "reference_images": [
      "evidence/captures/concept_direction_1_walnut_anodised.png",
      "evidence/captures/concept_direction_2_teak_silver_broadcast.png",
      "public/assets/textures/walnut_wood_grain.png",
      "public/assets/textures/vinyl_sleeve_art.png",
      "public/assets/textures/synth_faceplate_albedo.png",
      "public/assets/textures/turntable_deck_albedo.png",
      "public/assets/textures/ui_hardware_console_skin.png"
    ],
    "settled_decisions": [
      "0.8 m rack width (8 x 0.1 m source units) divided into 4 x 0.2 m module bays: VCO, VCF, ENV/VCA, LFO/DELAY.",
      "15-degree backward tilt on Synth_Faceplate_Frame for natural sightlines to all 16 knobs and 12 patch sockets.",
      "Custom 1974 dark-room studio environment map (dark acoustic ceiling + grazing 3200K warm key, cool cyan fill, and amber rim softbox strips) so the 180g vinyl LP stays jet-black with sharp anisotropic bow-tie groove reflections.",
      "Luthier-grade wood UV orientation along the longest axis of every cabinet cheek, rail, bullnose trim, and acoustic slat.",
      "240-segment 2-track cast-aluminium strobe platter rim with a glowing neon-amber prism tower, 45-RPM adapter puck, hydraulic cueing lever, and slotted die-cast magnesium headshell.",
      "Cross-bay patch cables routed through the clear horizontal corridor between upper [OUT] and lower [IN] jack rows so intermediate sockets (VCA GAIN CV) remain 100% unobstructed.",
      "GPU-composited brushed-metal hardware HUD (ui_hardware_console_skin.png, zero backdrop-filter blur) running at 60 FPS alongside 30 Hz throttled hover raycasting and fast oscilloscope telemetry."
    ]
  },
  "assets": [
    {
      "asset_id": "calibration_knob_glb",
      "type": "glb_model",
      "source_path": "blender/calibration_knob.blend",
      "runtime_path": "public/assets/models/calibration_knob.glb",
      "revision": 1,
      "generator_script": "scripts/build_calibration_knob.py"
    },
    {
      "asset_id": "studio_scene_glb",
      "type": "glb_model",
      "source_path": "blender/studio_scene.blend",
      "runtime_path": "public/assets/models/studio_scene.glb",
      "revision": 4,
      "generator_script": "scripts/build_studio_assets.py"
    },
    {
      "asset_id": "tex_walnut_albedo",
      "type": "texture_albedo",
      "source_path": "public/assets/textures/walnut_wood_grain.png",
      "runtime_path": "public/assets/textures/walnut_wood_grain.png",
      "revision": 4,
      "generator_script": "scripts/prepare_textures.py"
    },
    {
      "asset_id": "tex_walnut_normal",
      "type": "texture_normal",
      "source_path": "public/assets/textures/walnut_wood_normal.png",
      "runtime_path": "public/assets/textures/walnut_wood_normal.png",
      "revision": 4,
      "generator_script": "scripts/prepare_textures.py"
    },
    {
      "asset_id": "tex_walnut_roughness",
      "type": "texture_roughness",
      "source_path": "public/assets/textures/walnut_wood_roughness.png",
      "runtime_path": "public/assets/textures/walnut_wood_roughness.png",
      "revision": 4,
      "generator_script": "scripts/prepare_textures.py"
    },
    {
      "asset_id": "tex_faceplate_albedo",
      "type": "texture_albedo",
      "source_path": "public/assets/textures/synth_faceplate_albedo.png",
      "runtime_path": "public/assets/textures/synth_faceplate_albedo.png",
      "revision": 4,
      "generator_script": "scripts/prepare_textures.py"
    },
    {
      "asset_id": "tex_faceplate_normal",
      "type": "texture_normal",
      "source_path": "public/assets/textures/synth_faceplate_normal.png",
      "runtime_path": "public/assets/textures/synth_faceplate_normal.png",
      "revision": 4,
      "generator_script": "scripts/prepare_textures.py"
    },
    {
      "asset_id": "tex_faceplate_roughness",
      "type": "texture_roughness",
      "source_path": "public/assets/textures/synth_faceplate_roughness.png",
      "runtime_path": "public/assets/textures/synth_faceplate_roughness.png",
      "revision": 4,
      "generator_script": "scripts/prepare_textures.py"
    },
    {
      "asset_id": "tex_turntable_deck_albedo",
      "type": "texture_albedo",
      "source_path": "public/assets/textures/turntable_deck_albedo.png",
      "runtime_path": "public/assets/textures/turntable_deck_albedo.png",
      "revision": 4,
      "generator_script": "scripts/prepare_textures.py"
    },
    {
      "asset_id": "tex_turntable_deck_normal",
      "type": "texture_normal",
      "source_path": "public/assets/textures/turntable_deck_normal.png",
      "runtime_path": "public/assets/textures/turntable_deck_normal.png",
      "revision": 4,
      "generator_script": "scripts/prepare_textures.py"
    },
    {
      "asset_id": "tex_turntable_deck_roughness",
      "type": "texture_roughness",
      "source_path": "public/assets/textures/turntable_deck_roughness.png",
      "runtime_path": "public/assets/textures/turntable_deck_roughness.png",
      "revision": 4,
      "generator_script": "scripts/prepare_textures.py"
    },
    {
      "asset_id": "tex_studio_desk_albedo",
      "type": "texture_albedo",
      "source_path": "public/assets/textures/studio_desk_albedo.png",
      "runtime_path": "public/assets/textures/studio_desk_albedo.png",
      "revision": 4,
      "generator_script": "scripts/prepare_textures.py"
    },
    {
      "asset_id": "tex_studio_desk_normal",
      "type": "texture_normal",
      "source_path": "public/assets/textures/studio_desk_normal.png",
      "runtime_path": "public/assets/textures/studio_desk_normal.png",
      "revision": 4,
      "generator_script": "scripts/prepare_textures.py"
    },
    {
      "asset_id": "tex_studio_desk_roughness",
      "type": "texture_roughness",
      "source_path": "public/assets/textures/studio_desk_roughness.png",
      "runtime_path": "public/assets/textures/studio_desk_roughness.png",
      "revision": 4,
      "generator_script": "scripts/prepare_textures.py"
    },
    {
      "asset_id": "tex_ui_hardware_skin",
      "type": "texture_albedo",
      "source_path": "public/assets/textures/ui_hardware_console_skin.png",
      "runtime_path": "public/assets/textures/ui_hardware_console_skin.png",
      "revision": 4,
      "generator_script": "scripts/prepare_textures.py"
    },
    {
      "asset_id": "tex_vinyl_grooves_normal",
      "type": "texture_normal",
      "source_path": "public/assets/textures/vinyl_grooves_normal.png",
      "runtime_path": "public/assets/textures/vinyl_grooves_normal.png",
      "revision": 4,
      "generator_script": "scripts/prepare_textures.py"
    },
    {
      "asset_id": "tex_vinyl_label",
      "type": "texture_albedo",
      "source_path": "public/assets/textures/vinyl_label_albedo.png",
      "runtime_path": "public/assets/textures/vinyl_label_albedo.png",
      "revision": 4,
      "generator_script": "scripts/prepare_textures.py"
    },
    {
      "asset_id": "tex_sleeve_art",
      "type": "texture_albedo",
      "source_path": "public/assets/textures/vinyl_sleeve_art.png",
      "runtime_path": "public/assets/textures/vinyl_sleeve_art.png",
      "revision": 4,
      "generator_script": "scripts/prepare_textures.py"
    },
    {
      "asset_id": "audio_turntable_lp",
      "type": "audio_wav",
      "source_path": "public/assets/audio/chrono_analogue_side_a_33rpm.wav",
      "runtime_path": "public/assets/audio/chrono_analogue_side_a_33rpm.wav",
      "revision": 1,
      "generator_script": "scripts/generate_record_audio.py"
    }
  ],
  "materials": [
    {
      "material_id": "mat_walnut_cabinet",
      "base_color_hex": "#4e2c18",
      "roughness": 0.32,
      "metalness": 0.0,
      "textures": {
        "map": "public/assets/textures/walnut_wood_grain.png",
        "normalMap": "public/assets/textures/walnut_wood_normal.png",
        "roughnessMap": "public/assets/textures/walnut_wood_roughness.png"
      },
      "notes": "Hand-rubbed satin oiled American walnut cabinet cheeks, plinth, and bullnose rail with long-axis luthier UVs and clearcoat=0.54."
    },
    {
      "material_id": "mat_anodised_panel",
      "base_color_hex": "#101215",
      "roughness": 0.38,
      "metalness": 0.5,
      "textures": {
        "map": "public/assets/textures/synth_faceplate_albedo.png",
        "normalMap": "public/assets/textures/synth_faceplate_normal.png",
        "roughnessMap": "public/assets/textures/synth_faceplate_roughness.png"
      },
      "notes": "Deep charcoal-black brushed anodised aluminium panel with engraved bay seams, corner screws, shaft bushings, and cream silkscreen markings."
    },
    {
      "material_id": "mat_turntable_deck",
      "base_color_hex": "#1f2226",
      "roughness": 0.3,
      "metalness": 0.78,
      "textures": {
        "map": "public/assets/textures/turntable_deck_albedo.png",
        "normalMap": "public/assets/textures/turntable_deck_normal.png",
        "roughnessMap": "public/assets/textures/turntable_deck_roughness.png"
      },